id,district,areas,region,number_books,title_one,cover_one,author_one,summary_one,link_one,title_two,cover_two,author_two,summary_two,link_two
31,Indian River,"Port St. Lucie, Vero Beach, Sebastian, Fellsmere",South,156,Anne Frank's Diary: The Graphic Adaptation,annefrank.png,"Folman, Ari","For both young readers and adults The Diary continues to capture the remarkable spirit of Anne Frank, who for a time survived the worst horror the modern world has seen—and who remained triumphantly and heartbreakingly human throughout her ordeal.",https://www.penguinrandomhouse.com/books/549992/anne-franks-diary-the-graphic-adaptation-by-anne-frank/,"Assassination Classroom, Vol. 11",assassination.png,"Matsui, Yusei","Ever caught yourself screaming, “I could just kill that teacher”? What would it take to justify such antisocial behavior and weeks of detention? Especially if he’s the best teacher you’ve ever had? Giving you an “F” on a quiz? Mispronouncing your name during roll call...again? How about blowing up the moon and threatening to do the same to Mother Earth—unless you take him out first?! Plus, a reward of a cool 100 million from the Ministry of Defense! Okay, now that you’re committed... How are you going to pull this off? What does your pathetic class of misfits have in their arsenal to combat Teach’s alien technology, bizarre powers and...tentacles?! 3-E student Isogai breaks the school rules by working part-time to help support his family. When Gakushu and the rest of the Big Four students find out, they use his secret as leverage to force 3-E to participate in a bizarre sports-day competition. Soon it’s time for the school’s midterm competition as well, but when some 3-E students accidentally injure the elderly owner of a day care/after-school program, Koro Sensei forbids them from studying and orders them to replace him until he recovers! Assassination is one thing, but babysitting little kids…?! And then, our friends rescue a cat.",https://www.simonandschuster.com/books/Assassination-Classroom-Vol-11/Yusei-Matsui/Assassination-Classroom/9781421583235
32,Jackson,"Marianna, Cottondale, Sneads, Graceville, Grand Ridge, Malone",Panhandle,14,The Absolutely True Diary of a Part-Time Indian,truediary.png,"Alexie, Sherman","Heartbreaking, funny, and beautifully written, The Absolutely True Diary of a Part-Time Indian, which is based on the author's own experiences, coupled with poignant drawings by Ellen Forney that reflect the character's art, chronicles the contemporary adolescence of one Native American boy as he attempts to break away from the life he was destined to live.",https://www.hachettebookgroup.com/titles/sherman-alexie/the-absolutely-true-diary-of-a-part-time-indian-national-book-award-winner/9780316013680/?lens=little-brown-books-for-young-readers,Drama: A Graphic Novel,drama.png,"Telgemeier, Raina","Callie loves theater. And while she would totally try out for her middle school’s production of Moon Over Mississippi, she’s a terrible singer. Instead, she’s the set designer for the stage crew, and this year she’s determined to create a set worthy of Broadway on a middle-school budget. But how can she, when she doesn’t know much about carpentry, ticket sales are down, and the crew members are having trouble working together? Not to mention the onstage AND offstage drama that occurs once the actors are chosen, and when two cute brothers enter the picture, things get even crazier! Following the success of SMILE, Raina Telgemeier brings us another graphic novel featuring a diverse set of characters that humorously explores friendship, crushes, and all-around drama!",https://goraina.com/drama
33,Jefferson,Monticello,Panhandle,0,None,None,None,None,None,None,None,None,None,None
34,Lafayette,Mayo,North,0,None,None,None,None,None,None,None,None,None,None
35,Lake,"Clermont, Leesburg, Eustis, Tavares, Minneola, Mount Dora, Groveland, Mascotte, Umatilla, Altoona, Astatula, Fruitland Park, Sorrento, Lady Lake, Paisley, Howey-In-The-Hills",Central,13,Crank,crank.png,"Hopkins, Ellen","Kristina Snow is the perfect daughter: gifted high school junior, quiet, never any trouble. Then, Kristina meets the monster: crank. And what begins as a wild, ecstatic ride turns into a struggle through hell for her mind, her soul—her life.
",https://www.simonandschuster.com/books/Crank/Ellen-Hopkins/The-Crank-Trilogy/9781442471818,The Perks of Being a Wallflower,perks.png,"Chbosky, Stephen","The critically acclaimed debut novel from Stephen Chbosky follows observant “wallflower” Charlie as he charts a course through the strange world between adolescence and adulthood. First dates, family drama, and new friends. Sex, drugs, and The Rocky Horror Picture Show. Devastating loss, young love, and life on the fringes. Caught between trying to live his life and trying to run from it, Charlie must learn to navigate those wild and poignant roller-coaster days known as growing up.",https://www.simonandschuster.com/books/The-Perks-of-Being-a-Wallflower/Stephen-Chbosky/9781982110994
36,Lee,"Fort Myers, North Fort Myers, Fort Myers Beach, Bonita Springs, Cape Coral, Lehigh Acres, Estero, Alva, Boca Grande, Sanibel",South,30,Dreaming in Cuban,dreaming.png,"Garcia, Cristina","Cristina García’s acclaimed book is the haunting, bittersweet story of a family experiencing a country’s revolution and the revelations that follow. The lives of Celia del Pino and her husband, daughters, and grandchildren mirror the magical realism of Cuba itself, a landscape of beauty and poverty, idealism and corruption. Dreaming in Cuban is “a work that possesses both the intimacy of a Chekov story and the hallucinatory magic of a novel by Gabriel García Márquez” (The New York Times). In celebration of the twenty-fifth anniversary of the novel’s original publication, this edition features a new introduction by the author.",https://www.penguinrandomhouse.com/books/57953/dreaming-in-cuban-by-cristina-garcia/,More Happy Than Not,morehappy.png,"Silvera, Adam","In the months following his father’s suicide, sixteen-year-old Aaron Soto can’t seem to find happiness again, despite the support of his girlfriend, Genevieve, and his overworked mom. Grief and the smile-shaped scar on his wrist won’t let him forget the pain. But when Aaron meets Thomas, a new kid in the neighborhood, something starts to shift inside him. Aaron can’t deny his unexpected feelings for Thomas despite the tensions their friendship has created with Genevieve and his tight-knit crew. Since Aaron can’t stay away from Thomas or turn off his newfound happiness, he considers taking drastic actions. The Leteo Institute’s revolutionary memory-altering procedure will straighten him out, even if it means forgetting who he truly is.",https://www.penguinrandomhouse.com/books/243553/more-happy-than-not-deluxe-edition-by-silvera-adam-introduction-by-angie-thomas/
37,Leon,Tallahassee,Panhandle,5,Doomed,doomed.png,"Palahniuk, Chuck","After a botched Halloween ritual, Madison Spencer, the snarkiest dead girl in the universe, finds herself trapped in Purgatory, otherwise known as Earth. The upside: she is no longer subject to physical limitations (she can pass through doors and walls). The downside: well, she’s still dead. Her first stop is her parents’ luxurious apartment, where she encounters her grandmother's ghost. For Madison, the encounter triggers memories of the awful summer she spent upstate. As she revisits the painful truth of what transpired over those months, her saga of eternal damnation takes on a new and sinister meaning. It turns out, Madison and her parents have always been key elements of Satan’s master plan—doomsday.",https://www.penguinrandomhouse.com/books/126193/doomed-by-chuck-palahniuk/,Push,push.png,Sapphire,"Precious Jones, an illiterate sixteen-year-old, has up until now been invisible to the father who rapes her and the mother who batters her and to the authorities who dismiss her as just one more of Harlem’s casualties. But when Precious, pregnant with a second child by her father, meets a determined and radical teacher, we follow her on a journey of education and enlightenment as she learns not only how to write about her life, but how to make it truly her own for the first time.",https://www.penguinrandomhouse.com/books/677181/push-revised-by-sapphire/
38,Levy,"Chiefland, Bronson, Williston, Cedar Key, Yankeetown",North,0,None,None,None,None,None,None,None,None,None,None
39,Liberty,"Bristol, Hosford",Panhandle,0,None,None,None,None,None,None,None,None,None,None
40,Madison,"Madison, Greenville, Lee, Pinetta",Panhandle,0,None,None,None,None,None,None,None,None,None,None
41,Manatee,"Sarasota, Bradenton, Palmetto, Parrish, Holmes Beach, Lakewood Ranch, Myakka City, Fort Lauderdale",South,43,Friends Forever,friends.png,"Hale, Shannon","Shannon is in eighth grade, and life is more complicated than ever. Everything keeps changing, her classmates are starting to date each other (but nobody wants to date her!), and no matter how hard she tries, Shannon can never seem to just be happy. 
As she works through her insecurities and undiagnosed depression, she worries about disappointing all the people who care about her. Is something wrong with her? Can she be the person everyone expects her to be? And who does she actually want to be?
",https://us.macmillan.com/books/9781250849861/friendsforever,I Am Jazz,jazz.png,"Jennings, Jazz & Herthel, Jessica","From the time she was two years old, Jazz knew that she had a girl’s brain in a boy’s body. She loved pink and dressing up as a mermaid and didn’t feel like herself in boys’ clothing. This confused her family, until they took her to a doctor who said that Jazz was transgender and that she was born that way. Jazz’s story is based on her real-life experience, and she tells it in a simple, clear way that will be appreciated by picture book readers, their parents, and teachers.",https://www.penguinrandomhouse.com/books/315643/i-am-jazz-by-jessica-herthel-and-jazz-jennings-illustrated-by-shelagh-mcnicholas/
42,Marion,"Ocala, Belleview, Dunnellon, Citra, Summerfield, Anthony, Silver Springs, McIntosh, Reddick, Weirsdale, Fort McCoy",North,61,Flamer,flamer.png,"Curato, Mike","It's the summer between middle school and high school, and Aiden Navarro is away at camp. Everyone's going through changes—but for Aiden, the stakes feel higher. As he navigates friendships, deals with bullies, and spends time with Elias (a boy he can't stop thinking about), he finds himself on a path of self-discovery and acceptance.",https://us.macmillan.com/books/9781627796415/flamer,Not My Idea: A Book About Whiteness,notidea.png,"Higginbotham, Anastasia","Not My Idea is a sincere look at racial hierarchies—usually unspoken—that exist in America, and kids notice. It’s a gentle primer that helps white children see how white people have been socialized to see themselves as outside of conversations about race—and thus not part of ending racism. It’s written for children, so it is simple enough for adults to understand, if they are curious and open to new ideas.",https://www.dottirpress.com/not-my-idea
43,Martin,"Stuart, Jensen Beach, Palm City, Indiantown, Hobe Sound, Tequesta",South,92,All American Boys,american.png,"Reynolds, Jason & Kiely, Brandon","A bag of chips. That’s all sixteen-year-old Rashad is looking for at the corner bodega. What he finds instead is a fist-happy cop, Paul Galluzzo, who mistakes Rashad for a shoplifter, mistakes Rashad’s pleadings that he’s stolen nothing for belligerence, mistakes Rashad’s resistance to leave the bodega as resisting arrest, mistakes Rashad’s every flinch at every punch the cop throws as further resistance and refusal to STAY STILL as ordered. But how can you stay still when someone is pounding your face into the concrete pavement? There were witnesses: Quinn Collins—a varsity basketball player and Rashad’s classmate who has been raised by Paul since his own father died in Afghanistan—and a video camera. Soon the beating is all over the news and Paul is getting threatened with accusations of prejudice and racial brutality. Quinn refuses to believe that the man who has basically been his savior could possibly be guilty. But then Rashad is absent. And absent again. And again. And the basketball team—half of whom are Rashad’s best friends—start to take sides. As does the school. And the town. Simmering tensions threaten to explode as Rashad and Quinn are forced to face decisions and consequences they had never considered before.",https://www.simonandschuster.com/books/All-American-Boys/Jason-Reynolds/9781481463348,"Gabi, a Girl in Pieces",gabi.png,"Quintero, Isabel","Gabi Hernandez chronicles her last year of high school in her diary: college applications, Cindy's pregnancy, Sebastian's coming out, the cute boys, her father's meth habit, and the food she craves. And best of all, the poetry that helps forge her identity.",https://www.leeandlow.com/books/gabi-a-girl-in-pieces
44,Monroe,"Key West, Tavernier, Marathon, Big Pine Key, Key Largo, Summerland Key, Islamorada",South,0,None,None,None,None,None,None,None,None,None,None
45,Nassau,"Fernandina Beach, Hilliard, Callahan, Yulee, Bryceville, ",North,34,I Am Not Your Perfect Mexican Daughter,perfect.png,"Sanchez, Erika L.","Perfect Mexican daughters do not go away to college. And they do not move out of their parents’ house after high school graduation. Perfect Mexican daughters never abandon their family. But Julia is not your perfect Mexican daughter. That was Olga’s role. Then a tragic accident on the busiest street in Chicago leaves Olga dead and Julia left behind to reassemble the shattered pieces of her family. And no one seems to acknowledge that Julia is broken, too. Instead, her mother seems to channel her grief into pointing out every possible way Julia has failed. But it’s not long before Julia discovers that Olga might not have been as perfect as everyone thought. With the help of her best friend Lorena, and her first love, first everything boyfriend Connor, Julia is determined to find out. Was Olga really what she seemed? Or was there more to her sister’s story? And either way, how can Julia even attempt to live up to a seemingly impossible ideal?

",https://www.penguinrandomhouse.com/books/545723/i-am-not-your-perfect-mexican-daughter-by-erika-l-sanchez/,Nineteen Minutes,nineteen.png,"Picoult, Jodi","Sterling is an ordinary New Hampshire town where nothing ever happens--until the day its complacency is shattered by a school shooting. Josie Cormier, the daughter of the judge sitting on the case, should be the state's best witness, but she can't remember what happened before her very own eyes--or can she? As the trial progresses, fault lines between the high school and the adult community begin to show--destroying the closest of friendships and families. Nineteen Minutes asks what it means to be different in our society, who has the right to judge someone else, and whether anyone is ever really who they seem to be.",https://www.simonandschuster.com/books/Nineteen-Minutes/Jodi-Picoult/9780743496735
46,Okaloosa,"Fort Walton Beach, Niceville, Crestview, Miramar, Destin, Shalimar, Eglin Air Force Base, Mary Esther, Valparaiso, Baker, Laurel Hill",Panhandle,22,The Bluest Eye,bluest.png,"Morrison, Toni","In Morrison’s acclaimed first novel, Pecola Breedlove—an 11-year-old Black girl in an America whose love for its blond, blue-eyed children can devastate all others—prays for her eyes to turn blue: so that she will be beautiful, so that people will look at her, so that her world will be different. This is the story of the nightmare at the heart of her yearning, and the tragedy of its fulfillment.",https://www.penguinrandomhouse.com/books/117662/the-bluest-eye-by-toni-morrison/,One,One,One,One,One
47,Okeechobee,Okeechobee,South,0,None,None,None,None,None,None,None,None,None,None
48,Orange,"Orlando, Winter Park, Apopka, Belle Isle, Winter Garden, Ocoee, Windermere, Maitland, Eatonville, Zellwood, Miami",Central,673,Water for Elephants,elephants.png,"Gruen, Sara","As a young man, Jacob Jankowski was tossed by fate onto a rickety train that was home to the Benzini Brothers Most Spectacular Show on Earth. It was the early part of the great Depression, and for Jacob, now ninety (or ninety-three, he’s not quite sure), the circus world he remembers was both his salvation and a living hell. A veterinary student just shy of a degree, he was put in charge of caring for the circus menagerie. It was there that he met Marlena, the beautiful equestrian star married to August, the charismatic but twisted animal trainer. And he met Rosie, an untrainable elephant who was the great gray hope for this third-rate traveling show. The bond that grew among this unlikely trio was one of love and trust, and, ultimately, was their only hope for survival.",http://www.saragruen.com/author-books/books/water-for-elephants/,Shut Up!,shutup.png,"Reynolds, Marilyn","When seventeen-year-old Mario discovers their aunt’s boyfriend is molesting Eddie, he knows he has to take action to protect his little brother, even if it means giving up school, his girlfriend, everything he has known. Where can they run to be safe? The story of two brothers and their fight to survive.",https://newwindpublishing.com/book/shut-up/
49,Osceola,"Kissimmee, Celebration, Davenport, Harmony, Intercession City, St. Cloud, Orlando, Miami, Jacksonville, Hialeah Gardens, Riverview ",Central,26,All Boys Aren't Blue,boyblue.png,"Johnson, George M.","From the memories of getting his teeth kicked out by bullies at age five, to flea marketing with his loving grandmother, to his first sexual relationships, this young-adult memoir weaves together the trials and triumphs faced by Black queer boys. Both a primer for teens eager to be allies as well as a reassuring testimony for young queer men of color, All Boys Aren't Blue covers topics such as gender identity, toxic masculinity, brotherhood, family, structural marginalization, consent, and Black joy. Johnson's emotionally frank style of writing will appeal directly to young adults.
",https://us.macmillan.com/books/9780374312718/allboysarentblue,Looking for Alaska,alaska.png,"Green, John","Miles Halter is fascinated by famous last words—and tired of his safe life at home. He leaves for boarding school to seek what the dying poet François Rabelais called the “Great Perhaps.” Much awaits Miles at Culver Creek, including Alaska Young, who will pull Miles into her labyrinth and catapult him into the Great Perhaps. Looking for Alaska brilliantly chronicles the indelible impact one life can have on another. A modern classic, this stunning debut marked #1 bestselling author John Green’s arrival as a groundbreaking new voice in contemporary fiction.",https://www.penguinrandomhouse.com/books/292717/looking-for-alaska-by-john-green/
50,Palm Beach,"Boca Raton, Jupiter, Lake Worth, Palm Beach, Palm Springs, West Palm Beach, Palm Beach Springs, Palm Beach Gardens,  Royal Palm Beach, Delray Beach, Boynton Beach, Belle Glade, Lantana, Pahokee, Riviera, Riviera Beach, Greenacres, Wellington, Loxahatchee, Miami, Boca Raton, Canal Point, Lake Park, South Bay",South,26,The 1619 Project: Born on the Water,bornwater.png,"Hannah-Jones, Nikole","A young student receives a family tree assignment in school, but she can only trace back three generations. Grandma gathers the whole family, and the student learns that 400 years ago, in 1619, their ancestors were stolen and brought to America by white slave traders. But before that, they had a home, a land, a language. She learns how the people said to be born on the water survived.",https://www.penguinrandomhouse.com/books/653856/the-1619-project-born-on-the-water-by-nikole-hannah-jones-and-renee-watson-illustrated-by-nikkolas-smith/,It Feels Good To Be Yourself: A Book About Gender Identity,goodyourself.png,"Thorn, Theresa","Some people are boys. Some people are girls. Some people are both, neither, or somewhere in between. This sweet, straightforward exploration of gender identity will give children a fuller understanding of themselves and others. With child-friendly language and vibrant art, It Feels Good to Be Yourself provides young readers and parents alike with the vocabulary to discuss this important topic with sensitivity.",https://us.macmillan.com/books/9781250302953/itfeelsgoodtobeyourself
51,Pasco,"Dade City, New Port Richey, Port Richey, Holiday, St. Leo, Land O Lakes, Wesley Chapel, Hudson, Trinity, San Antonio, Zephyrhills, Spring Hill, Lutz, Odessa",Central,1,The Letter Q: Queer Writers' Notes to their Younger Selves,q.png,"Moon, Sarah","In this anthology, sixty-three award-winning authors such as Michael Cunningham, Amy Bloom, Jacqueline Woodson, Gregory Maguire, David Levithan, and Armistead Maupin make imaginative journeys into their pasts, telling their younger selves what they would have liked to know then about their lives as Lesbian, Gay, Bisexual, or Transgender people. Through stories, in pictures, with bracing honesty, these are words of love and understanding, reasons to hold on for the better future ahead. They will tell you things about your favorite authors that you never knew before. And they will tell you about yourself.",https://www.scholastic.ca/books/view/the-letter-q,One,One,One,One,One
52,Pinellas,"St. Petersburg, Clearwater, Gulfport, Kenneth City, Dunedin, Tarpon Springs, Largo, Seminole, Pinellas Park, Palm Harbor, Safety Harbor, Oldsmar",Central,2,The Bluest Eye,bluest.png,"Morrison, Toni","In Morrison’s acclaimed first novel, Pecola Breedlove—an 11-year-old Black girl in an America whose love for its blond, blue-eyed children can devastate all others—prays for her eyes to turn blue: so that she will be beautiful, so that people will look at her, so that her world will be different. This is the story of the nightmare at the heart of her yearning, and the tragedy of its fulfillment.",https://www.penguinrandomhouse.com/books/117662/the-bluest-eye-by-toni-morrison/,Gender Queer: A Memoir,genderqueer.png,"Kobabe, Maia","In 2014, Maia Kobabe, who uses e/em/eir pronouns, thought that a comic of reading statistics would be the last autobiographical comic e would ever write. At the time, it was the only thing e felt comfortable with strangers knowing about em. Now, Gender Queer is here. Maia’s intensely cathartic autobiography charts eir journey of self-identity, which includes the mortification and confusion of adolescent crushes, grappling with how to come out to family and society, bonding with friends over erotic gay fanfiction, and facing the trauma and fundamental violation of pap smears. Started as a way to explain to eir family what it means to be nonbinary and asexual, Gender Queer is more than a personal story: it is a useful and touching guide on gender identity—what it means and how to think about it—for advocates, friends, and humans everywhere.",https://www.simonandschuster.com/books/Gender-Queer-A-Memoir/Maia-Kobabe/9781549304002
53,Polk,"Lakeland, Winter Haven, Lake Wales, Babson Park, Auburndale, Bartow, Davenport, Lake Alfred, Dundee, Fort Meade, Frostproof, Haines City, Eagle Lake, Poinciana, Mulberry, Alturas, Eloise, Polk City",Central,16,The Vincent Boys,vincent.png,"Glines, Abbi","Ashton is getting tired of being good, of impressing her parents and playing ideal girlfriend to Sawyer Vincent. Sawyer is perfect, a regular Prince Charming, but when he leaves town for the summer, it’s his cousin Beau who catches Ashton’s eye. Beau is the sexiest guy she’s ever seen, and even though he’s dangerous, Ashton is drawn to him. Beau loves his cousin like a brother, so the last thing he wants to do is make a move on Sawyer’s girl. Ashton is off-limits, absolutely. That’s why he does his best to keep his distance, even though he’s been in love with her forever. When Ashton wants to rekindle their childhood friendship in Sawyer’s absence, Beau knows he should say no. Ashton and Beau don’t want to hurt Sawyer. But the more they try to stay away from each other, the more intense their urges become. It’s getting way too hard to resist...",https://www.simonandschuster.com/books/The-Vincent-Boys/Abbi-Glines/9781442485259,Two Boys Kissing,twoboys.png,"Levithan, David","Based on true events—and narrated by a Greek Chorus of the generation of gay men lost to AIDS—Two Boys Kissing follows Harry and Craig, two seventeen-year-olds who are about to take part in a 32-hour marathon of kissing to set a new Guinness World Record. While the two increasingly dehydrated and sleep-deprived boys are locking lips, they become a focal point in the lives of other teens dealing with universal questions of love, identity, and belonging.",https://www.penguinrandomhouse.com/books/217499/two-boys-kissing-by-david-levithan/
54,Putnam,"Crescent City, Interlachen, Palatka, Florahome, San Mateo, Melrose, Hawthorne",North,0,None,None,None,None,None,None,None,None,None,None
